Channel,Title,Views,Post-Time
T-Series,#TujheBhulaDiya 😭#RanbirKapoor 👨‍🎤 #SadSongStatus 💔 #PriyankaChopra 👩‍🎤 Sad Status #shorts,11K views,4 hours ago
T-Series,"MASTI TAKITA DHUM (Full Vudio) Shabaash Mithu | Taapsee P, Lagnajita, Anusha Mani, Amit T | M Kumar",22K views,6 hours ago
T-Series,Mere Dil Gaaye Ja (Zooby Zooby) Dhokha | R. Madhavan Khushalii K|Tanishk Kumaar Zahrah Yash Bhushan,798K views,9 hours ago
T-Series,Ganpati Bappa Morya (Video Jukebox) Filmy Ganpati Utsav | Ganpati Festival 2022 | Ganpati Songs,94K views,17 hours ago
T-Series,Sabri Brothers: Teri Jawani Badi Mast Mast Hai (Full Song) | Pyar Kiya To Darna Kya | Dance Song,78K views,1 day ago
T-Series,"Pihu Pihu (Audio) : Token - The Treasure | Tarannum M, Jasleen M, Dilip Sen| M. Prakash | Bhushan K",29K views,1 day ago
T-Series,"Mere Dil Gaaye Ja (Zooby Zooby) SONG TEASER | Dhokha | Tanishk Bagchi, Zahrah K, Yash N | Bhushan K",353K views,1 day ago
T-Series,"Jubin Nautiyal, Payal Dev: Meethi Meethi | Rashmi Virag | Shanvi Srivastava | Vijay,Bosco| Bhushan K",7.4M views,1 day ago
T-Series,"Sonu Nigam, Anuradha Paudwal: Woh Ho Tum (HD Full Song) Muskaan",42K views,2 days ago
T-Series,"Anand Raj Anand: Oye Raju Pyar Na Kariyo | Govinda, Rani Mukherjee | Sad Song",47K views,2 days ago
T-Series,"Tu Pyar Hai Kisi Aur Ka | Kumar Sanu, Anuradha Paudwal | 90s Hit Song | HD Song",33K views,2 days ago
T-Series,#LoveStatus ❤️#lovesong 💘 Woh Ho Tum 👩‍❤️‍👩 #Shorts 😻,56K views,2 days ago
T-Series,#SadSongStatus 💔Oye Raju Pyar Na Kariyo 💔#Govinda 💔#SadSong 💔 Anand Raj Anand,102K views,2 days ago
T-Series,#KumarSanu | Tu Pyaar Hai Kisi Aur Ka 💔 #SadStatus 💔 #AamirKhan | Song Status #Shorts,28K views,2 days ago
T-Series,"Jubin Nautiyal: Teri Galliyon Se (Lyrical) | Gurmeet Choudhary, Arushi, Navjit| Meet Bros| Bhushan K",173K views,2 days ago
T-Series,"Ankhiyon Se Goli Maare | Sonu Nigam, Jaspinder Narula | Govinda Songs | Raveena Tandon Song |HD Song",89K views,2 days ago
T-Series,Ankhiyon Se Goli Mare 😉 #Govinda 🕺 #RaveenaTandon 💃🏻 #DanceShorts | Status Video,54K views,2 days ago
T-Series,Teri Jawani Badi Mast Mast Hai ❤️‍🩹 #DanceShorts 💃 #SadStatus 💔 #Arbaazkhan | Sabri Brothers #shorts,49K views,2 days ago
T-Series,"Sonu Nigam, Sapna Awasthi | Sab Kuchh Bhula Diya [Full HD] Hum Tumhare Hain Sanam",72K views,3 days ago
T-Series,"Tere Vich Rab Disda (Lyrical) | Shamita S, Raqesh B| Meet Bros Sachet-Parampara | Manoj | Bhushan K",339K views,3 days ago
T-Series,"Behind The Scenes: Teri Galliyon Se (Jubin Nautiyal) | Gurmeet, Arushi, Navjit| Meet Bros| Bhushan K",231K views,3 days ago
T-Series,"Guru Randhawa: Signs (Video) | Man Of The Moon | Rupan Bal, Sanjoy | Bhushan Kumar",8.1M views,3 days ago
T-Series,"Naginwala Song (Audio) - Token: The Treasure | Anup Jalota, Jasleen Matharu | Rani Hazarika",11K views,3 days ago
T-Series,"Behind The Scenes: Barsaat Ho Jaaye | Jubin Nautiyal | Shivin,Ridhi | Payal,Rashmi Virag | Bhushan K",55K views,4 days ago
T-Series,Sab Kuch Bhula Diya ❤️‍🩹 #SadSong 💔 #MadhuriDixit 💃 #shahrukhkhan  | Sad Status Song | #shorts,360K views,4 days ago
T-Series,"B Praak: Dhoke Pyaar Ke (Audio)| Khushalii Kumar, Ehan Bhat, Vardhan Puri | Rochak Kohli | Bhushan K",83K views,4 days ago
T-Series,"Vikram Vedha Teaser | Hrithik Roshan, Saif Ali Khan | Pushkar & Gayatri | Radhika Apte|Bhushan Kumar",22M views,6 days ago
T-Series,"Pihu Pihu (Lyrical): Token - The Treasure | Tarannum M, Jasleen M, Dilip S| M. Prakash | Bhushan K",60K views,7 days ago
T-Series,"Naginwala Song (Lyrical) - Token: The Treasure | Anup Jalota, Jasleen Matharu | Rani Hazarika",55K views,7 days ago
T-Series,Hey Fakira Hindi Video Song | Vikrant Rona | Kichcha Sudeep | Nirup Bhandari | Anup Bhandari,61K views,7 days ago
Cocomelon - Nursery Rhymes,Fire Engine Song | CoComelon Nursery Rhymes & Kids Songs,504K views,8 hours ago
Cocomelon - Nursery Rhymes,The Wheels on the Bus Dance | CoComelon Nursery Rhymes & Kids Songs - Dance Party,4.5M views,3 days ago
Cocomelon - Nursery Rhymes,Play Outside at the Beach Song | CoComelon Nursery Rhymes & Kids Songs,21M views,7 days ago
Cocomelon - Nursery Rhymes,Opposites Song + More Nursery Rhymes & Kids Songs - CoComelon,9.7M views,10 days ago
Cocomelon - Nursery Rhymes,Let's Go Camping Song | Summer Family Fun | CoComelon Nursery Rhymes & Kids Songs,13M views,2 weeks ago
Cocomelon - Nursery Rhymes,Baa Baa Black Sheep (Pretend Play Edition) + More Nursery Rhymes & Kids Songs - CoComelon,10M views,2 weeks ago
Cocomelon - Nursery Rhymes,Yes Yes Vegetables #2 CoComelon Nursery Rhymes & Kids Songs,13M views,3 weeks ago
Cocomelon - Nursery Rhymes,Shopping Cart Song + More Nursery Rhymes & Kids Songs - CoComelon,24M views,3 weeks ago
Cocomelon - Nursery Rhymes,Los Pollitos Dicen Dance | Dance Party | CoComelon Nursery Rhymes & Kids Songs,8.8M views,4 weeks ago
Cocomelon - Nursery Rhymes,Birthday At The Farm Song + More Nursery Rhymes & Kids Songs - CoComelon,20M views,1 month ago
Cocomelon - Nursery Rhymes,Finger Family Song + More Nursery Rhymes & Kids Songs - CoComelon,8.9M views,1 month ago
Cocomelon - Nursery Rhymes,Baa Baa Black Sheep | CoComelon Nursery Rhymes & Kids Songs,13M views,1 month ago
Cocomelon - Nursery Rhymes,Birthday Song + More Nursery Rhymes & Kids Songs - CoComelon,14M views,1 month ago
Cocomelon - Nursery Rhymes,Big Brother Song + More Nursery Rhymes & Kids Songs - CoComelon,8.7M views,1 month ago
Cocomelon - Nursery Rhymes,JJ's Birthday At The Farm Song | CoComelon Nursery Rhymes & Kids Songs,10M views,1 month ago
Cocomelon - Nursery Rhymes,Baa Baa Black Sheep Dance | Dance Party | + More Nursery Rhymes & Kids Songs - CoComelon,6.6M views,1 month ago
Cocomelon - Nursery Rhymes,Cody's Spy Song + More Nursery Rhymes & Kids Songs - CoComelon,8.7M views,1 month ago
Cocomelon - Nursery Rhymes,JJ's Birthday Surprise Song | CoComelon Nursery Rhymes & Kids Songs,22M views,1 month ago
Cocomelon - Nursery Rhymes,Go Before You Go Song + More Nursery Rhymes & Kids Songs - CoComelon,12M views,1 month ago
Cocomelon - Nursery Rhymes,Belly Button Dance | Dance Party | CoComelon Nursery Rhymes & Kids Songs,26M views,1 month ago
Cocomelon - Nursery Rhymes,Twinkle Twinkle Little Star + More Nursery Rhymes & Kids Songs - CoComelon,25M views,1 month ago
Cocomelon - Nursery Rhymes,Go Before You Go Song | CoComelon Nursery Rhymes & Kids Songs,10M views,2 months ago
Cocomelon - Nursery Rhymes,London Bridge + More Nursery Rhymes & Kids Songs - CoComelon,22M views,2 months ago
Cocomelon - Nursery Rhymes,Freeze Dance | Dance Party | CoComelon Nursery Rhymes & Kids Songs,32M views,2 months ago
Cocomelon - Nursery Rhymes,Wheels On The Bus + More Nursery Rhymes & Kids Songs - CoComelon,36M views,2 months ago
Cocomelon - Nursery Rhymes,Twinkle Twinkle Little Star | CoComelon Nursery Rhymes & Kids Songs,31M views,2 months ago
Cocomelon - Nursery Rhymes,Pets For Kids Song + More Nursery Rhymes & Kids Songs - CoComelon,21M views,2 months ago
Cocomelon - Nursery Rhymes,Following In Dads Footsteps Song | CoComelon Nursery Rhymes & Kids Songs,13M views,2 months ago
Cocomelon - Nursery Rhymes,Head Shoulders Knees and Toes + More Nursery Rhymes & Kids Songs - CoComelon,18M views,2 months ago
Cocomelon - Nursery Rhymes,London Bridge Is Falling Down Song | CoComelon Nursery Rhymes & Kids Songs,21M views,2 months ago
SET India,Chunky जी ने क्यों की Aryananda की Singing को Record? | Superstar Singer Season 2| Aryananda Special,17K views,45 minutes ago
SET India,Rituraj & Sayisha की Cute Performances ने जीता सभी का दिल | Superstar Singer Season 2| Girls VS Boys,11K views,1 hour ago
SET India,Sayisha-Pawandeep के Duet ने किया Judges को खड़े होने पर मजबूर |Superstar Singer Season 2| Album Mix,20K views,1 hour ago
SET India,Final पड़ाव पर आकर किसकी Singing आएगी Judges को पसंद? | Superstar Singer Season 2| Aryananda VS Mani,15K views,1 hour ago
SET India,Revelation Of Those Traumatic Events! | Crime Patrol | Inspector Series,22K views,2 hours ago
SET India,Yashomati Maiyaa Ke Nandlala - यशोमती मैय्या के नंदलाला - Ep 60 - Coming Up Next,4.3K views,2 hours ago
SET India,Pranjal के High Notes ने कर दिया सबको Melodiously High! |Superstar Singer Season 2 |Pranjal Special,10K views,2 hours ago
SET India,Bade Achhe Lagte Hain 2 - Ep 263 - Coming Up Next - बड़े अच्छे लगते हैं 2,17K views,2 hours ago
SET India,Suresh Will Walk On Path Of Non-Violence | Mere Sai | Mon - Fri At 7 PM,2.2K views,2 hours ago
SET India,Rituraj ने Himesh का Challenge Accept किया Superspeed से |Superstar Singer Season 2 |Rituraj Special,7.3K views,2 hours ago
SET India,Punyashlok Ahilya Bai - Ep 433 - Coming Up Next - पुण्यश्लोक अहिल्या बाई,11K views,2 hours ago
SET India,देखिए इस Trio की एक Unique Performance | Superstar Singer | Ganesh Chaturthi Special,2.7K views,2 hours ago
SET India,Mere Sai - Ep 1210 - Coming Up Next - मेरे साईं,2.5K views,2 hours ago
SET India,The Kapil Sharma Show | Kyun Daala Iss 'Guitar' Ne 'Tabla' Par Powder? | Best Moments,12K views,3 hours ago
SET India,The Kapil Sharma Show | Kya Aditya Ko Hai Baithke Kamaane Se Dikkat? | Best Moments,25K views,4 hours ago
SET India,Appnapan - Badalate Rishton Ka Bandhan - अपनापन बदलते रिश्तों का बंधन - Ep 56 - Coming Up Next,17K views,4 hours ago
SET India,मारुति ने बढ़ाया अतिबल का मनोबल | Sankatmochan Mahabali Hanuman - Ep 105 | Full Episode,7.1K views,4 hours ago
SET India,Grand Finale | India's Laughter Champion - Ep 20 | Full Episode | 27 August 2022,88K views,4 hours ago
SET India,क्या Kartik Aaryan को देखकर बदला गया था Film का Character? | The Kapil Sharma Show | Full Episode,6.6K views,5 hours ago
SET India,Fire of Hatred | Crime Patrol | Toxic Relationships,19K views,5 hours ago
SET India,Danish के इस Devotional गाने ने जीता सबका दिल | Indian Idol | Ganesh Chaturthi Special,7.4K views,5 hours ago
SET India,Dharam जी ने बताया उनके Films में आने का Secret | India's Best Dancer | Celebrity Special,7.7K views,5 hours ago
SET India,अंजना माता का अतीत आया उनके सामने | Sankatmochan Mahabali Hanuman - Ep 104 | Full Episode,5.9K views,6 hours ago
SET India,The Secret | Bade Achhe Lagte Hain - Ep 316 | Full Episode,35K views,6 hours ago
SET India,Nitin की इस Performance ने किया सबको Impress | Indian Idol | Special Selection,8K views,6 hours ago
SET India,A Case That Leaves A Black Mark On Everyone! | Crime Patrol 2.0 | New Episodes | Mon-Fri At 11:00 PM,12K views,7 hours ago
SET India,Mani की मधुर Singing ने Judges को किया Emotional | Superstar Singer S2 | Musical Hits,16K views,7 hours ago
SET India,Ram Lets Krish Win The Game For Pihu! | Bade Achhe Lagte Hain 2 | Mon - Fri At 8:00 PM,341K views,7 hours ago
SET India,Faiz की Singing के सब हैं दीवाने | Superstar Singer Season 2 | Faiz Special,45K views,7 hours ago
SET India,Mani का यह Performance देखकर सब मजबूर हो गए Stage पर आने को |Superstar Singer Season 2 |Mani Special,84K views,7 hours ago
MrBeast,I Survived A Plane Crash,41M views,9 days ago
MrBeast,"I Gave My 100,000,000th Subscriber An Island",64M views,3 weeks ago
MrBeast,"100,000,000 Subscriber Special",19M views,4 weeks ago
MrBeast,"100 Girls Vs 100 Boys For $500,000",73M views,1 month ago
MrBeast,I Didn’t Eat Food For 30 Days,51M views,1 month ago
MrBeast,I Built Willy Wonka's Chocolate Factory!,100M views,2 months ago
MrBeast,"$10,000 Every Day You Survive Prison",94M views,4 months ago
MrBeast,"Would You Swim With Sharks For $100,000?",86M views,5 months ago
MrBeast,World’s Most Dangerous Escape Room!,126M views,7 months ago
MrBeast,"Extreme $1,000,000 Hide And Seek",72M views,8 months ago
MrBeast,"$1,000,000 Influencer Tournament!",58M views,8 months ago
MrBeast,I Got Hunted By The Military,83M views,8 months ago
MrBeast,"$456,000 Squid Game In Real Life!",286M views,9 months ago
MrBeast,I Cleaned The World’s Dirtiest Beach #TeamSeas,68M views,10 months ago
MrBeast,"Last To Take Hand Off Lamborghini, Keeps It",98M views,10 months ago
MrBeast,"First To Rob Bank Wins $100,000",81M views,11 months ago
MrBeast,"Extreme $500,000 Game Of Tag!",80M views,11 months ago
MrBeast,"Last To Leave Circle Wins $500,000",181M views,11 months ago
MrBeast,I Got Hunted By The FBI,103M views,1 year ago
MrBeast,"If You Can Carry $1,000,000 You Keep It!",86M views,1 year ago
MrBeast,"Would YOU Quit School For $100,000?",74M views,1 year ago
MrBeast,I Survived 50 Hours In A Maximum Security Prison,118M views,1 year ago
MrBeast,"Hit The Target, Win $300,000",107M views,1 year ago
MrBeast,Anything You Can Fit In The Triangle I’ll Pay For,91M views,1 year ago
MrBeast,I Got Hunted By A Real Bounty Hunter,106M views,1 year ago
MrBeast,"Extreme $100,000 Game of Tag!",109M views,1 year ago
MrBeast,"Would You Sit In Snakes For $10,000?",157M views,1 year ago
MrBeast,"I Bought The World's Largest Mystery Box! ($500,000)",136M views,1 year ago
MrBeast,I Spent 50 Hours Buried Alive,192M views,1 year ago
MrBeast,"Offering People $100,000 To Quit Their Job",94M views,1 year ago
Kids Diana Show,Diana Roma Oliver Birthday Video Collection,276K views,5 hours ago
Kids Diana Show,Diana and Roma Family trip to the sea,3.1M views,4 days ago
Kids Diana Show,Diana and Roma Escape Room and more funny challenges,1.2M views,7 days ago
Kids Diana Show,Diana and Roma Back to School stories,5.7M views,9 days ago
Kids Diana Show,Diana Roma and Oliver Have a Fun Day at the Kids Club,8.8M views,12 days ago
Kids Diana Show,Diana and Roma Family summer vacation,8.5M views,2 weeks ago
Kids Diana Show,Diana and Roma play outdoors / best parks for kids,7.6M views,3 weeks ago
Kids Diana Show,Diana and Roma show School rules / New Back to School story,8.2M views,3 weeks ago
Kids Diana Show,Diana and Roma visited Disneyland!,8.1M views,4 weeks ago
Kids Diana Show,Diana and Oliver - favorite stories with little brother,15M views,1 month ago
Kids Diana Show,Diana and Roma Kids Activities during the summer vacation,19M views,1 month ago
Kids Diana Show,Diana and Roma Family Fun Time at the Amusement Park,9.1M views,1 month ago
Kids Diana Show,Diana and Roma help Oliver and other New stories,15M views,1 month ago
Kids Diana Show,Diana Roma and Oliver play Different Jobs and Professions,18M views,1 month ago
Kids Diana Show,Diana and Roma in the Escape Room Challenge,166M views,1 month ago
Kids Diana Show,Diana and Roma Follow the Rules / video compilation,16M views,1 month ago
Kids Diana Show,Diana and Roma 24 Hours on the Boat Challenge,20M views,1 month ago
Kids Diana Show,Diana and Roma at School - A Story about the Value of Friendship,80M views,2 months ago
Kids Diana Show,Diana and Dad in The Magic Story of Studying at Home,34M views,2 months ago
Kids Diana Show,Diana and Roma Adventure in the Cinema and other Funniest videos for kids,90M views,2 months ago
Kids Diana Show,Diana teaches baby Oliver | Developmental Games for a 1+ Year Old,11M views,2 months ago
Kids Diana Show,Diana and Roma have fun on the First Day of Summer following safety tips,44M views,2 months ago
Kids Diana Show,Diana and useful stories about good behavior from her life,159M views,2 months ago
Kids Diana Show,Diana and Roma play Cinema challenge,69M views,2 months ago
Kids Diana Show,Diana teaches Roma how to keep Eyesight,8M views,2 months ago
Kids Diana Show,Diana and Roma came up with How to Entertain baby Oliver | Fun Toddler Activities,33M views,2 months ago
Kids Diana Show,Diana and Roma Travel - Video compilation about fun family trips,52M views,3 months ago
Kids Diana Show,Diana and Mom visit the dentist / Brush your teeth story,32M views,3 months ago
Kids Diana Show,Diana and Roma - Family Trip to Turkey,21M views,3 months ago
Kids Diana Show,Diana is studying the rules of conduct at the airport,30M views,3 months ago
Like Nastya,Nastya learns how important it is for children to wear braces,3.1M views,5 days ago
Like Nastya,Nastya does good deeds like a superhero,4.4M views,8 days ago
Like Nastya,Nastya and the most interesting moments from the summer vacation,4.4M views,11 days ago
Like Nastya,Nastya and her back to school in the third grade,2.9M views,13 days ago
Like Nastya,Nastya and a family trip to London with dad,5.1M views,2 weeks ago
Like Nastya,Nastya shows how to entertain each other with her dad,9.6M views,2 weeks ago
Like Nastya,Nastya learns to say the magic word Please and receives a gift,3.2M views,3 weeks ago
Like Nastya,Nastya kids stories and summer rules,26M views,3 weeks ago
Like Nastya,Nastya and dad Family fun time in the Land of Legends park,7.5M views,1 month ago
Like Nastya,Nastya and kids outdoor activities in Turkey,29M views,1 month ago
Like Nastya,Nastya and her friends are trying to find their favorite hobbies,19M views,1 month ago
Like Nastya,Nastya and Dad travel around Italy on summer vacation,5.6M views,1 month ago
Like Nastya,Nastya and stories about how important it is to take care of your health,22M views,1 month ago
Like Nastya,Nastya and summer safety rules for children,10M views,1 month ago
Like Nastya,Nastya is learning how to get new information during the summer holidays,10M views,1 month ago
Like Nastya,Nastya at School and other Stories about the Importance of Studying,42M views,1 month ago
Like Nastya,Nastya and Dad learn how to cook pasta in Italy,11M views,1 month ago
Like Nastya,Nastya shows 5 sights worth visiting during a family trip to Switzerland,9M views,2 months ago
Like Nastya,Nastya shows that washing hands is not boring at all,46M views,2 months ago
Like Nastya,Nastya and dad travel in Alsace and in the gingerbread museum,6.2M views,2 months ago
Like Nastya,Nastya and the rules of conduct in the Hotel,16M views,2 months ago
Like Nastya,Nastya and the most important safety rules for children,34M views,2 months ago
Like Nastya,Nastya shows the safety rules in the pool,63M views,2 months ago
Like Nastya,Nastya shows the harm of sugar on health,12M views,2 months ago
Like Nastya,"Nastya at School - Video compilation about school, friendship and knowledge",42M views,2 months ago
Like Nastya,Nastya and the story about school bullying,125M views,2 months ago
Like Nastya,Nastya learns how important it is to read books,16M views,3 months ago
Like Nastya,Nastya and the story about learning from home,4.8M views,3 months ago
Like Nastya,Nastya and stories about how important it is to be kind and honest,45M views,3 months ago
Like Nastya,Nastya learns to earn money honestly,36M views,3 months ago
WWE,"FULL MATCH — Rey Mysterio vs. Eddie Guerrero — Steel Cage Match: SmackDown, Sept. 9, 2005",2.5K views,15 minutes ago
WWE,"FULL MATCH — Priest vs. McIntyre vs. Sheamus — United States Title Match: Raw, Aug. 30, 2021",21K views,2 hours ago
WWE,Roman Reigns has the best trash talk,30K views,3 hours ago
WWE,Not familiar with Johnny Gargano? Let Johnny Wrestling himself get you up to speed! #Short,39K views,5 hours ago
WWE,"FULL MATCH — ""Hollywood"" Hulk Hogan vs. Diamond Dallas Page: WCW Monday Nitro, March 29, 1999",21K views,5 hours ago
WWE,Every Roman Reigns championship defense of the last 2 years: WWE Playlist,547K views,6 hours ago
WWE,"Rey Mysterio & Rob Van Dam vs. The Dudley Boyz: SmackDown, Sept. 16, 2004",35K views,11 hours ago
WWE,"Rodriguez & Aliyah vs. Kai & SKY — WWE Women’s Tag Team Title Match: Raw, Aug. 29, 2022",291K views,14 hours ago
WWE,"Rodriguez & Aliyah know how hard they worked for the gold: RAW Exclusives, Aug. 29, 2022",103K views,14 hours ago
WWE,"The magic of Edge & Rey Mysterio is back to take down The Judgement Day: WWE RAW Talk, Aug. 29, 20..",59K views,14 hours ago
WWE,"Kurt Angle says being back on Raw is a pleasure: RAW Exclusive, Aug. 29, 2022",79K views,14 hours ago
WWE,Don’t miss the final NXT before Sunday's World’s Collide tonight,14K views,14 hours ago
WWE,"Kevin Owens vs. Jey Uso: Raw, Aug. 29, 2022",345K views,14 hours ago
WWE,"Kevin Owens confronts The Usos & Sami Zayn: Raw, Aug. 29, 2022",368K views,14 hours ago
WWE,"Lashley will always be a fighting United States Champion: Raw Exclusive, Aug. 29, 2022",32K views,14 hours ago
WWE,"Seth “Freakin” Rollins makes Matt Riddle go ballistic following interview: Raw, Aug. 29, 2022",172K views,14 hours ago
WWE,"Theory accuses Gargano of being jealous of his success: Raw Exclusive, Aug. 29, 2022",80K views,14 hours ago
WWE,"Edge pulls a joke on Kurt Angle: Raw, Aug. 29, 2022",516K views,14 hours ago
WWE,WWE and Connor's Cure honor those battling cancer during Pediatric Cancer Awareness Month,354K views,14 hours ago
WWE,"Bobby Lashley vs. The Miz: Raw, Aug. 29, 2022",243K views,14 hours ago
WWE,"Matt Riddle engages in a war of words with Seth “Freakin” Rollins: Raw, Aug. 29, 2022",142K views,14 hours ago
WWE,"The Street Profits vs. Alpha Academy: Raw, Aug. 29, 2022",149K views,14 hours ago
WWE,"The Street Profits step up to help Kurt Angle against Alpha Academy: Raw, Aug. 29, 2022",194K views,14 hours ago
WWE,"Titus O’Neil announces a $100,000 donation to Connor’s Cure: RAW Exclusive, Aug. 29, 2022",23K views,14 hours ago
WWE,"Bianca Belair, Alexa Bliss, & Asuka vs. local athletes: Raw, Aug. 29, 2022",196K views,15 hours ago
WWE,"The Miz scared after learning Dexter Lumis was released from jail: Raw, Aug. 29, 2022",176K views,15 hours ago
WWE,"The Mysterios help Edge repel The Judgment Day with Kendo sticks: Raw, Aug. 29, 2022",364K views,15 hours ago
WWE,"AJ Styles & Dolph Ziggler vs. The Judgment Day: Raw, Aug. 29, 2022",183K views,15 hours ago
WWE,Roman Reigns celebrates two years as champion on the eve of WWE Clash at the Castle this Friday,68K views,16 hours ago
WWE,POV: You’re ready for WWE RAW #Short,74K views,18 hours ago
Zee Music Company,"गुंडागर्दी Gundagardi Full Movie | Dharmendra, Raj Babbar, Vijayshanti | Super Hit Action Movie",27K views,4 hours ago
Zee Music Company,"नाम गुम जाएगा Naam Gum Jaayega - Full Movie | Dia Mirza, Divya Dutta, Sandeep Mehta, Aryan Vaid",2.2K views,4 hours ago
Zee Music Company,"शरारत Shararat - Full Movie | Abhishek Bachchan, Hrishitaa Bhatt, Amrish Puri & Om Puri",4.8K views,4 hours ago
Zee Music Company,"मातृभूमि Matrubhoomi - Full Movie | Tulip Joshi, Piyush Mishra, Vinamra Pancharia, Sushant Singh",4.3K views,5 hours ago
Zee Music Company,"रोग Rog - Full Movie | Irrfan Khan, Ilene Hamann & Himanshu Malik | M. M. Kreem",5.1K views,5 hours ago
Zee Music Company,"Cuttputlli - Full Album | Akshay Kumar, Rakul Preet, Sargun M | Tanishk Bagchi, Dr Zeus, Aditya Dev",33K views,6 hours ago
Zee Music Company,"कोई मेरे दिल से पूछे Koi Mere Dil Se Poochhe - Full Movie | Aftab Shivdasani, Esha Deol",14K views,7 hours ago
Zee Music Company,Dafn-E-Dil - Official Music Video | Talha Ahan | Aaqib Mirza | Danish Alfaaz | Shikha Thakur,35K views,10 hours ago
Zee Music Company,"Rabba - Cuttputlli | Akshay Kumar & Rakul Preet | Dr Zeus, Sukhwinder Singh, Omar Malik",3.6M views,12 hours ago
Zee Music Company,"Itni Mohabbat Karta Hoon - Hiba N, Karan J | Nihal T, Amjad Nadeem Aamir, Azeem| Zee Music Originals",262K views,12 hours ago
Zee Music Company,"प्रेम शक्ति Prem Shakti Full Movie | Govinda, Karishma Kapoor | Bollywood Classic Movies",10K views,1 day ago
Zee Music Company,"कुन्दन  Kundan - Full Movie | Dharmendra, Jaya Prada, Amrish Puri & Farha Naaz",184K views,1 day ago
Zee Music Company,"परदेसी Pardesi - Full Movie | Mithun Chakraborty, Varsha Usgaonkar | Bollywood Classic Movies",252K views,1 day ago
Zee Music Company,"गुनहगार Gunehgar - Full Movie | Pooja Bhatt, Mithun Chakraborty & Atul Agnihotri",95K views,1 day ago
Zee Music Company,"Middle-Class Love | Dialogue Promo 1 | Prit K, Kavya T, Eisha S | Ratnaa S | Anubhav S | 16th Sept",13K views,1 day ago
Zee Music Company,"अँधा युद्ध Andha Yudh - Full Movie | Raj Babbar, Nana Patekar, Divya Rana & Rohini Hattangadi",68K views,1 day ago
Zee Music Company,#AjnabeeHoGaye #SarojKaRishta #ArmaanMalik #KunaalVermaa #SanahKapur #RandeepRai #KumudMishra#shorts,50K views,1 day ago
Zee Music Company,"निशाना Nishana - Full Movie | Mithun Chakraborty, Rekha, Paresh Rawal, Pankaj Dheer, Raza Murad",21K views,1 day ago
Zee Music Company,Soni Mahi - Official Video Song | Vaishnavi Andhale & Shubam Sharma | Piyush Sharma,20K views,1 day ago
Zee Music Company,"Chaiyaan Mein Saiyaan Ki - Full | Khuda Haafiz 2 | Vidyut J, Shivaleeka O| Mithoon, Asees K, Jubin N",154K views,1 day ago
Zee Music Company,"Rubaru - Full Video | Khuda Haafiz 2 | Vidyut J, Shivaleeka O | Vishal Mishra, Asees Kaur, Manoj M",51K views,1 day ago
Zee Music Company,"Junoon Hai - Full Video | Khuda Haafiz 2 | Vidyut J | Shabbir A, Saaj B, Brijesh S, Anis S, Faruk K",12K views,1 day ago
Zee Music Company,"Aaja Ve - Full Video | Khuda Haafiz 2 | Vidyut J & Shivaleeka O | Vishal Mishra, Kaushal K, Faruk K",13K views,1 day ago
Zee Music Company,"रिटर्न ऑफ़ ज्वेल थीफ Return of Jewel Thief - Full Movie | Ashok Kumar, Dev Anand, Dharmendra, Jackie",114K views,1 day ago
Zee Music Company,"Ishq Pashmina - Official Teaser | Bhavin Bhanushali, Malti Chahar, Zareena Wahaab",409K views,1 day ago
